{
  "name": "cnaf",
  "lang": "fr",
  "jurisdiction": "Prestations familiales et sociales françaises — modèle indépendant Arxo, sans affiliation à la CNAF",
  "primaryJurisdiction": "FR",
  "serverName": "arxo-cnaf-mcp",
  "prefixes": [
    "fr-aah",
    "fr-apl",
    "fr-apl-versement",
    "fr-css-ajpa",
    "fr-income-for-apl",
    "fr-minima-ressources",
    "fr-pass",
    "fr-pf-aeeh",
    "fr-pf-af",
    "fr-pf-ajpp",
    "fr-pf-ars",
    "fr-pf-asf",
    "fr-pf-cf",
    "fr-pf-cmg",
    "fr-pf-core",
    "fr-pf-paje",
    "fr-ppa",
    "fr-prestations-versement",
    "fr-revalorisation",
    "fr-rsa",
    "fr-smic"
  ],
  "borrowed": [],
  "calendarPackage": null,
  "canon": "fr.benefits/0.1.0",
  "requireExplicitContext": true,
  "note": "Aperçu technique du corpus figé. Chaque demande d’exécution précise legalTime et context (timezone, decisionTime, knowledgeTime). L’absence de conclusion ne vaut pas refus d’une prestation. Les lectures et paramètres doivent être explicites; aide_formule ne désigne pas un paiement définitif.",
  "facets": {
    "allow": [
      "reference",
      "execution"
    ],
    "deny": {
      "argumentation": "Cette facette n’est pas acceptée dans le premier aperçu CNAF.",
      "process": "Les procédures exigent une acceptation séparée.",
      "editions": "L’aperçu utilise les éditions figées du manifeste.",
      "feedback": "Aucun service externe de retour ou de publication n’est configuré.",
      "drafting": "La formalisation et ses analyses restent dans le dépôt de développement.",
      "adversarial": "La recherche de contournements ne fait pas partie de la surface publique.",
      "editing": "Le corpus figé n’est pas modifié par le serveur."
    }
  }
}
